{
  "id": "debugpy-installer",
  "name": "debugpy",
  "check": {
    "exec": {
      "name": "Check if debugpy is installed",
      "command": "python -c \"import debugpy\"",
      "timeout": 5000
    }
  },
  "run": {
    "exec": {
      "name": "Install debugpy",
      "command": "pip install debugpy"
    }
  }
}
