{
  "id": "vscode-css-language-server-installer",
  "name": "vscode-css-language-server",
  "check": {
    "fileExists": {
      "name": "Check if vscode-css-language-server is installed",
      "file": "${serverHome}/node_modules/.bin/vscode-css-language-server*"
    }
  },
  "run": {
    "exec": {
      "name": "Install vscode-langservers-extracted",
      "workingDir": "${serverHome}/node_modules",
      "command": {
        "windows": "npm.cmd install vscode-langservers-extracted --force",
        "default": "npm install vscode-langservers-extracted --force"
      },
      "onSuccess": {
        "configureServer": {
          "name": "Configure CSS language server command",
          "command": {
            "windows": "${serverHome}/node_modules/.bin/vscode-css-language-server.cmd --stdio",
            "default": "${serverHome}/node_modules/.bin/vscode-css-language-server --stdio"
          }
        }
      }
    }
  }
}
