{
  "id": "lemminx",
  "name": "LemMinX (XML Language Server)",
  "check": {
    "fileExists": {
      "name": "Check if LemMinX is installed",
      "file": "${serverDist}/lemminx.jar"
    }
  },
  "run": {
    "download": {
      "name": "Download LemMinX",
      "url": "https://download.eclipse.org/lemminx/releases/0.31.2/org.eclipse.lemminx-uber.jar",
      "output": {
        "file": {
          "name": "lemminx.jar",
          "executable": true
        }
      },
      "onSuccess": {
        "configureServer": {
          "name": "Configure LemMinX server command",
          "command": "java -cp \"${serverDist}/${dist.file}\" org.eclipse.lemminx.XMLServerLauncher"
        }
      }
    }
  }
}
