{
  "id": "perlnavigator-installer",
  "name": "perlnavigator",
  "check": {
    "fileExists": {
      "name": "Check if PerlNavigator is installed",
      "file": {
        "windows": "$SERVER_HOME$/perlnavigator.exe",
        "default": "$SERVER_HOME$/perlnavigator"
      }
    }
  },
  "run": {
    "download": {
      "name": "Download PerlNavigator",
      "github": {
        "owner": "bscan",
        "repository": "PerlNavigator",
        "prerelease": false,
        "asset": {
          "windows": {
            "x86_64": "perlnavigator-win-x86_64.zip"
          },
          "unix": {
            "x86_64": "perlnavigator-linux-x86_64.zip"
          },
          "mac": {
            "x86_64": "perlnavigator-macos-x86_64.zip"
          }
        }
      },
      "output": {
        "dir": "$SERVER_HOME$",
        "file": {
          "name": {
            "windows": "perlnavigator.exe",
            "default": "perlnavigator"
          },
          "executable": true
        }
      },
      "onSuccess": {
        "configureServer": {
          "name": "Configure PerlNavigator command",
          "command": {
            "windows": "$SERVER_HOME$/perlnavigator.exe --stdio",
            "default": "$SERVER_HOME$/perlnavigator --stdio"
          }
        }
      }
    }
  }
}
